{
  "id": "employment_offer_letter",
  "title": "Employment Offer Letter",
  "category": "employment",
  "jurisdiction": "Generic",
  "language": "en-US",
  "description": "A conditional offer letter for a new employee.",
  "variables": [
    {
      "name": "candidate_name",
      "label": "Candidate full name",
      "type": "string",
      "required": true
    },
    {
      "name": "company_name",
      "label": "Company legal name",
      "type": "string",
      "required": true
    },
    {
      "name": "position_title",
      "label": "Position title",
      "type": "string",
      "required": true
    },
    {
      "name": "manager_name",
      "label": "Manager name",
      "type": "string",
      "required": true
    },
    {
      "name": "start_date",
      "label": "Start date",
      "type": "date",
      "required": true
    },
    {
      "name": "work_location",
      "label": "Work location",
      "type": "string",
      "required": true
    },
    {
      "name": "base_salary",
      "label": "Base salary",
      "type": "currency",
      "required": true
    },
    {
      "name": "employment_type",
      "label": "Employment type",
      "type": "choice",
      "required": true,
      "options": ["full-time", "part-time", "temporary"]
    },
    {
      "name": "acceptance_deadline",
      "label": "Acceptance deadline",
      "type": "date",
      "required": true
    }
  ],
  "sections": [
    {
      "heading": "Offer",
      "body": "{{company_name}} is pleased to offer {{candidate_name}} the position of {{position_title}}, reporting to {{manager_name}}."
    },
    {
      "heading": "Start Date and Location",
      "body": "Your anticipated start date is {{start_date}}. Your primary work location will be {{work_location}}."
    },
    {
      "heading": "Compensation",
      "body": "Your base salary will be {{base_salary}}, subject to applicable withholdings and deductions."
    },
    {
      "heading": "Employment Type",
      "body": "This is a {{employment_type}} position. Employment is subject to company policies as amended from time to time."
    },
    {
      "heading": "Conditions",
      "body": "This offer may be conditioned on verification of work authorization, satisfactory background checks where permitted, and completion of required onboarding documentation."
    },
    {
      "heading": "At-Will Statement",
      "body": "Where permitted by applicable law, employment is at will and either you or the company may end the employment relationship at any time, with or without cause or notice."
    },
    {
      "heading": "Acceptance",
      "body": "To accept this offer, please sign and return this letter by {{acceptance_deadline}}."
    }
  ],
  "review_notes": [
    "Remove or revise at-will language where it is not legally appropriate.",
    "Add benefits, equity, bonus, restrictive covenant, or immigration language when relevant.",
    "Confirm wage notice and local employment law requirements."
  ]
}
