{
  "id": "power_of_attorney",
  "title": "Limited Power of Attorney",
  "category": "authorization",
  "jurisdiction": "Generic",
  "language": "en-US",
  "description": "A limited authorization for an agent to act on behalf of a principal for defined matters.",
  "variables": [
    {
      "name": "principal_name",
      "label": "Principal full legal name",
      "type": "string",
      "required": true
    },
    {
      "name": "principal_address",
      "label": "Principal address",
      "type": "address",
      "required": true
    },
    {
      "name": "agent_name",
      "label": "Agent full legal name",
      "type": "string",
      "required": true
    },
    {
      "name": "agent_address",
      "label": "Agent address",
      "type": "address",
      "required": true
    },
    {
      "name": "powers_granted",
      "label": "Powers granted",
      "type": "string",
      "required": true
    },
    {
      "name": "effective_date",
      "label": "Effective date",
      "type": "date",
      "required": true
    },
    {
      "name": "expiration_date",
      "label": "Expiration date",
      "type": "date",
      "required": false
    },
    {
      "name": "governing_law",
      "label": "Governing law",
      "type": "string",
      "required": true
    }
  ],
  "sections": [
    {
      "heading": "Appointment",
      "body": "{{principal_name}}, residing at {{principal_address}}, appoints {{agent_name}}, residing at {{agent_address}}, as agent and attorney-in-fact for the limited purposes described in this document."
    },
    {
      "heading": "Powers Granted",
      "body": "The agent may act on behalf of the principal only for the following matters: {{powers_granted}}."
    },
    {
      "heading": "Limitations",
      "body": "The agent may not delegate authority, make gifts, change beneficiary designations, or take any action outside the powers expressly granted unless separately authorized by law or written instrument."
    },
    {
      "heading": "Effective Period",
      "body": "This power of attorney is effective on {{effective_date}} and expires on {{expiration_date}}, unless revoked earlier in writing by the principal."
    },
    {
      "heading": "Reliance",
      "body": "Third parties may rely on a copy of this document as if it were an original, subject to applicable law."
    },
    {
      "heading": "Governing Law",
      "body": "This document is governed by the laws of {{governing_law}}."
    }
  ],
  "review_notes": [
    "Check notarization, witness, statutory form, and recording requirements.",
    "Confirm whether durable authority is intended or prohibited.",
    "Specify exact transactions or institutions when a broad grant would be inappropriate."
  ]
}
